Category,Resume
ACCOUNTANT,"INVESTMENT ACCOUNTANT
Career Focus
Accomplished and results oriented Investment professional with strong leadership and interpersonal skills who adds energy and value to an
organization's quest for excellence.
Summary of Skills
Internet and Microsoft Office - MS Word, MS Power Point, MS Excel, Pivot Tables, Spreadsheets,
Variance analysis
Macros.
Detail-oriented
Analytical
Expert in MS Office Suite
* Business Objects, Lombardi, Eagle Accounting System, PEGA, DRAS, Workbench.
Account reconciliation expert
Effective time management
Account reconciliations Complex problem solving
Superior research skills
Detail-oriented
Accomplishments
Multiple awards for performance.Formally recognized for excellence achieved in financial analysis, budgeting and forecasting.Increased efficiency
of discrepancy investigations by [Number]% by designing a more accurate cash-forecasting system.
Professional Experience
Company Name City , State Investment Accountant 10/2012 to 11/2015
Reconciled mutual fund accounts with the custody Identified and Resolved differences in Custody and Accounting Cash, Currency and
Positions using Eagle, IAX, Business Objects, Lombardi and Workbench Reports Communicated and Collaborated with other areas in the
firm, client, fund accountant, custodians that are impacted by the functions of the team Conducted weekly client meetings and act as liaison
between Accounting and custody to resolve any outstanding items in cash, currency and positions.
Completed special projects from the management as needed Trained, Oversee and assisted staff in offshore team (Pune, India) and acted as
a liaison between Pune Office and US.
Helped US team by performing tests on Pega Vs.
Business Objects and Eagle during the Platform Migration Trained new staff and assist them as needed to meet the department goals.
Ran daily reports for fund accountants using business objects and MS Database.
Award: Received a special achievement award at BNY Mellon Bank in Asset Servicing (Dec 2013) Award: Received a special
achievement award at BNY Mellon Bank in Asset Servcing (Dec 2014.
Company Name City , State AML Compliance Officer 11/2011 to 03/2012
Audited customer's bank accounts in the company's system Performed quality assurance reviews on customer information maintained on
various bank systems Reconciled the quality assurance results on spreadsheets Performed background search on clients using tools such as
world check and google search Finance Projects at UD Project 1: Group simulation project to develop the investment philosophy and
strategy to drive a simulated investment of $1,000,000 using Stock-Track.
Invested about 50% of our funds in moderate to high-risk investment in order to achieve capital appreciation; Invested about 25% of our
funds in low to moderate risk investment in order to preserve our capital.
Invested 25% of our funds in derivatives and rest in index fund, cash and money market.
Performed an analysis to determine the allocation of stocks by minimizing CV and graphed the daily returns for each stocks Performed
regression analysis and analyzed the regression statistics on weekly returns.
Performed an analysis on our group's portfolio with the market and with other groups.
Case analysis on Price Momentum Strategy Used price momentum model analysis to test whether the price momentum model will work on
US stock market as it did with the US Canadian stocks.
Used the weighted annual returns and created the worst outlook portfolio and the best outlook portfolio Selected the top eight performing
stocks for each quarter to create the best outlook portfolio and compared to the market to determine if the pricing momentum would hold
up.
Calculated the average return for each portfolio and rebalanced the portfolio and compared to the S&P 500 for each quarter within the
same time period.
Company Name City , State Medical Technologist 07/2008 to 03/2012
Clinical Microbiology Experience - Highlights include ordering, processing, plating and culturing patient's specimens Tests - Performingrapid tests such as Rapid flu, C.Diff quick check and many more; Performing rapid and confirmatory tests to identify organism; Reading
Gram stain slides.
Other - Performing daily maintenance and running quality control on instruments.
Education
Master of Business Administration : Finance 2011 University of Delaware , City , State , USA
Finance
Bachelor of Science : Medical Technology 2008 University of Delaware , City , State , USA
Medical Technology
Related course work in Business: Financial Reporting and Analysis, Financial Management, Corporate Financial Policies, Investment Analysis and
Portfolio Management, Corporate Governance, Financial Engineering and Risk Management (Derivatives).
Languages
English, Marathi, Hindi, Gujarati
Personal Information
Excellent multitasking, analytical thinking, time management, negotiation, communication, organization and leadership skills
Additional Information
Excellent multitasking, analytical thinking, time management, negotiation, communication, organization and leadership skills
Skills
MS Office: Database, Macros, V-look up, Pivot tables, Outlook
Company Platforms: Business Objects, Workbench, Eagle, Pega, Lombardi, DRAS."
ACCOUNTANT,"ACCOUNTANT
Summary
To pursue excellence in the dynamic business world by obtaining a placement allowing me to perform in an environment where honesty, sincerity &
a positive attitude would be valued. I would like to take up a challenging job to nourish my qualification , expertise & experience within a reputed
organization & further enhance my performance. Flexible [Job Title] who adapts seamlessly to constantly evolving accounting processes and
technologies. Flexible [Job Title] who adapts seamlessly to constantly evolving accounting processes and technologies.
Highlights
Dos , Windows 9.x , XP, MS Office, Oracle, Tally, Adobe Photoshop , Adobe Illustrator, Pagemaker, 3d Inifnative, Account
Audio Editing, Video Editing , Macro Media Director, Oracle 8I, Developer 2000. reconciliations
Accomplishments
Enter outstanding achievements that show you can go above and beyond basic job expectations. See Examples General Ledger Accounts
Maintained accurate accounts including cash, inventory, prepaid, fixed assets, accounts payable, accrued expenses and line of credit
transactions.
Experience
October 2011
to
August 2015
Company Name City , State Accountant
Prepared monthly and annual expense forecasts, including any necessary recommended action required to manage costs to achieve budget.
Performed debit, credit and total accounts on computer spreadsheets/databases, using specialized accounting software. Responsible to
ensure that receivables are timely collected, Participate in preparation of Monthly Management reports, Stock taking, monthly, quarterly and
yearly and running reports for inventory control and analysis, Inspection and follow up of warehouse for stock movement.
Review of taxation documents and applications for clients, Preparing for cost analysis and variance reports, and supporting management in
cost modeling and overhead cost allocation, Processing for final payment for suppliers and staff.
Assisting management in Budget preparation, Checking of proper documentation before payment disbursement.
Reconciliation of Bank Statements, staff account and supplier accounts, Financial ratios and analysis report of the same, Making MIS report
for CFO and senior Management, Coordinating with other departments for financial management.
January 2009
to
September 2011
Company Name City , State Accountant
Reviewed accountantÃ†s book entries to ensure accuracy of the G/L. Responsible to ensure that receivables are timely collected,
Participate in preparation of Monthly Management reports, Stock taking, monthly, quarterly and yearly and running reports for inventory
control and analysis, Inspection and follow up of warehouse for stock movement.
Preparing for cost analysis and variance reports, and supporting management in cost modeling and overhead cost allocation, Maintaining
staff accounts and processing staff salary, leave, and final settlement in timely manner after checking of documents and auditing of the same.
Processing for final payment for suppliers and staff, Processing and review of tax documents, Assisting management in Budget preparation,
Checking of proper documentation before payment disbursement, Liaising with HR and suppliers for payroll and other disbursement.
Reconciliation of Bank Statements, staff account and supplier accounts, Financial ratios and analysis report of the same, Giving guidance
and support for general staff for payroll and finance, Making MIS report for CFO and senior Management, Coordinating with other
departments for financial management.
Aug'07- Dec'08 Auto1 (Al-Ghannam Auto World Co.
WLL), Kuwait Accountant: Responsible to ensure that liabilities are paid on time and receivables are timely collected, Participate in
preparation of Monthly Management reports, Maintaining accounts on daily basis, Stock taking and inventory report as well as warehouse
inspection, Preparing and disbursing salary and leave to staff after checking of proper documentation, Reconciliation of Bank Statements,
MIS report for senior management.
April 2006
to
May 2007
Company Name City , State Accountant
Received, recorded, and banked cash, checks, and vouchers as well as reconciled records of bank transactions. Responsible for payable
are paid on time and receivables are timely collected, Ensures Co.
policies related to payments, and contracts are completely followed.
Preparing payroll for staff, Preparation of Financial Statements.
October 2001
to
March 2006Company Name City , State Account Assistant
Performed debit, credit and total accounts on computer spreadsheets/databases, using specialized accounting software. Maintaining
Accounts on daily basis up to finalization, Follow up Accounts receivables and daily reporting to the Management, Preparation of Inventory
Reports, Sales Invoices , Purchase Invoices and all accounting Vouchers of debit & credit.
Sep' 2K- Sep'01 Digital Vish Computers, Udaipur (Raj.) India.
Maintaining Cash books and Journal book and reconciliation of bank accounts, Preparation of Cash Vouchers & handle petty cash, Daily
routine banking works etc.
Education
2006
Vidyasagar University City , State , India MBA : Finance Finance
2000
Mohan Lal Sukhadia University City , State , India Select...
Skills
3d, accounting, Accountant, Accounts receivables, Adobe Illustrator, Adobe Photoshop, Pagemaker, Audio Editing, auditing, banking, book,
Budget preparation, contracts, cost analysis, credit, clients, debit, Dec, documentation, Dos, senior Management, finance, Financial, financial
management, Preparation of Financial Statements, HR, Inspection, Inventory, inventory control, Macro Media Director, MS Office, 2K,
Windows 9.x, works, MIS, modeling, Developer 2000, Oracle 8I, Oracle, payroll, policies, reporting, Sales, tax, Video Editing
Affiliations
Enter any professional organizations that you are involved in.
See Examples"
ACCOUNTANT,"ACCOUNTANT
Summary
To utilize my customer relations and management background to obtain a position with a company that places importance on efficiency and
success. Employ natural leadership and interpersonal skills to build relationships throughout the organization.
Experience
Accountant Aug 2015 to Current
Company Name ï¼​ City , State
Accounting for six companiesÂ
Maintained confidential information, such as pay rates, bonus targets and pay grades
Processed payroll, electronic deposits and employee pay adjustments
Reconciled all bank and credit card accounts
Processed journal entries, online transfers and payments (internal and external)
Analyzed cost control and provided timely financial information to support company goals
Cost effective purchasing (office equipment & supplies, janitorial, food & beverage)
Reviewed book entries to ensure accuracy of the G/L
Assisted the CFO with the production of the monthly financials and management reportsÂ
Prepared monthly and annual expense forecasts, including any necessary recommended action required to manage costs to achieve budget
Tracked and verified accurate receipt of purchase orders and verified costs against vendor invoicesÂ
Processed A/P weekly, working with 50+ vendors
Processed company purchase orders and communicated with customers regarding orders
Researched and resolved collections and billing disputes with tact and efficiency
Researched and resolved billing and invoice problems
â€‹
Director of Finance & Accounts Jun 2014 to Aug 2015
Company Name
Responsible for daily entry of accounting transactions.
Received, recorded, and deposited cash and checks as well as reconciled records of bank transactions.
Verified purchase orders, managed accounts payable invoices and supplied payments to vendors on a weekly basis.
Reconciled all bank and credit card accounts.
Researched and resolved collections and billing disputes.
Processed payroll, electronic deposits and employee pay adjustments for 70+.
Issued paychecks to contractors on a bi-weekly basis.
Issued W2.
s to employees & 1099.
s to contractors.
Maintained confidential information, such as pay rates, bonus targets and pay grades.
Processed journal entries, online transfers and payments.
Produced monthly financial summaries and reports.
Maintained employee files, incident reports, unemployment claims and training progress.
Maintained office inventory.
Operations & TrainingConsultant, Franchisee & General Manager Feb 2004 to Current
Company Name ï¼​ State
Training & Operations Consultant July 2015 - Current
Assist six store franchise in training staff and streamlining operations in accordance with corporate standards
Monthly unannounced inspections to inspect product and operation standards
Work with store managers in developing effective action plans for improvement and guide team members in execution of determined plans
Â Franchisee Â June 2007 - February 2011
Grow a performance culture, based on teamwork, innovation and training Creatively constructing advertising and promotional deals in
accordance with corporate initiatives
Implemented and maintained corporate standards
Drive revenue and reduce expenditures to meet and exceed revenue and profit targets
Maintain integrity of stores, including coding, sanitation, equipment and major appliances
Labor and food cost management; Inventory management
Community and customer relations
Established and implemented internal training and time-management program
Handled tasks related to payroll, inventory and job scheduling
Managed accounts payable and accounts receivable in conjunction with company accountants
Prepared reports, spreadsheets, and administrative documents Maintained office calendars, open and prioritize mail, receive and prioritizephone calls
General Manager Â February 2004 - April 2007
Orchestrating and directing crew consisting of up to 20 people.
Hire, develop and promote talented employees who fit the unique cultures of the restaurant environment.
Improve operational statistics and efficiency.
Patient Service Representative Jun 2012 to Nov 2016
Company Name
Consistently build positive report with patients while accurately and efficiently registering in a timely manner.
Perform daily administrative duties including: cash management and internal quality assurance.
Insurance processing and communication.
Patient account resolution and billing assistance.
Provide Preliminary assessment of patient health.
Serve as liaison between patients and medical providers.
Mentor new employees on company policies and practices.
Develop and implement client service techniques to better serve both the patient and corporate needs.
Compliance and comprehension of HIPPA regulations.
Effectively prioritize tasksÂ
Education
Bachelor of Science , Accounting Strayer University ï¼​ City , State"
ACCOUNTANT,"ACCOUNTANT II
Accomplishments
Military Training Certificate, 2005; PNC Conversation: Deep Dive into Savings and Investment training 2012; Operational and Soundness
Training 2013; Employee of the month (November) at PNC Bank 2011; Employee of the Quarter at PNC Bank 2011; Retail Banking
Achievement Award 2012;.
NMLS- Nationwide Mortgage Licensing System, 2013.
Supervision
Supervised team of two staff members.Â
Professional Summary
Detail-oriented Accountant with 5 years effectively maintaining accurate accounting information for large-scale financial organizations.
Skills
Superior attention to detail
Accounting operations professional
Invoice coding familiarity
Cash flow analysis
QuickBooks expert
Data trending knowledge
Self-motivated professional
Advanced bookkeeping skills
Strong communication skills
Work History
Accountant II , 02/2017 to Current
Company Name â€“ City , State
Responsible for preparing and posting entries for the daily posting packet.
Verifies and balances system originated interfaces and posts non-system generated transactions prepared from other sources.
System originated interfaces refers to the Credit Union owned system as well as external systems, such as shared branching and ATM
transaction networks.
A monitor flow of credit union transactions from the various supporting systems into and out of the general ledger daily, and identifies and
resolves errors, omissions, and irregularities to provide accurate records for TFCU and its service organizations.
Calculates and posts month end and year-end accruals as needed.
Responsible for maintaining fixed assets and prepaid sub-ledger accounts.
Prepares budget variance reports for various departments as assigned.
Works with that department manager in preparation of annual budget.
Responds to inquiries from that manager regarding budgeted and actual expenses.
Prepares analyses as requested by manager and other departments.
Manages the accounts payable function - including employee/volunteer reimbursement - from processing incoming invoices, through cost
center coding, approval by appropriate party, input into the system, to check preparation and mailing.
Identifies vendors requiring an IRS Form 1099 and prepares the form and transmittal.
Manages the Corporate VISA accounts for managers and volunteers, including ordering and canceling cards, processing corporate Visa
accounts for payment, and resolving discrepancies.
Along with other Finance Department staff, processes outgoing and incoming wires, verifies those wires have all required documentation,
and works with branch staff to ensure incoming wires are posted and resolve issues.
Responsible for assisting with the preparation of financial statements.
Accountant , 06/2015 to 02/2017
Company Name â€“ City , State
40hrs Coordinate and supervise employees within Accounts Payable interacting with internal customers and external suppliers monitoring all
controls.
Oversee employee business expense processing for multiple business units leading projects such as system testing and implementation.
Communicate accounting policies practices and procedures with department manager's vendors and internal customers to ensure
compliance.
Maintains knowledge of all Credit Union processes which affect the general ledger, including share drafts, ACH, wire transfers, ATM,
Federal Reserve, and Credit Cards.
Responsible for reconciliation of the clearing accounts, including vault, transfer, on us, bond clearing and cashier check clearing among it's
stock ownership.
Responsible for preparing month end and posting entries.
Responsible for assisting with the preparation of financial statements.
Prepare verified processed and maintained a variety of order reconciliation functions.
Use office automated systems to input data generate reports conduct investigations and respond to inquiries.
Maintains records for vendors and accounts payable, including 1099s and corporate Visa accounts.
Accountant , 08/2013 to 06/2015
Company Name â€“ City , State40hrs Perform a variety of support duties related to the accounting function within the credit union; assisting the accounting team in
maintaining the financial, statistical, and accounting records; Accounts Payable processing; posting general ledger entries; reconciling general
ledger accounts as assigned and miscellaneous filing/scanning of checks, invoices and branch daily work.
Prepare daily cash flow, examined, and analyzed accounting record, financial statements, ACH, wires, and other financial reports to assess
accuracy, completeness, and conformation to reporting and procedural standards.
Responsible and supervised two Accounting Clerks Staff, scheduling shifts, assigning responsibilities, answering questions, solving problems,
helping with complex transactions and sensitive member relations issues or concerns.
Articulate policies and procedures to members and department staff Maintains files, including filing of general ledger journal vouchers,
account payable documentation, and other miscellaneous fillings.
Print daily account payable checks and inserts checks and invoices into envelopes for mailing.
Verifies and posts details of business transactions, such as funds received and disbursed, and totals accounts, using calculator or computer.
Responsible for ensuring staff are adequately trained in all phases of their jobs; and informed regarding all credit union products and services
Effectively research, track, and resolve or properly refer accounting or documentation problems and discrepancies.
Maintains regular contact with other departments to obtain and convey information and/or to correct transactions.
Order cash from the Federal Reserve for the branches and ATMs in a timely manner.
Financial Service Representative/ Back-up Supervisor , 01/2011 to 08/2013
Company Name â€“ City
40hrs Provided customers with prompt, accurate, courteous and professional banking service.
Identified and referred sales opportunities to Relationship Bankers about products and services.
Utilized several mediums such as phone and emails to help customers.
Assisted customers with opening and closing of accounts.
Answered and resolved problems that are within my authority.
Accepted and processed loan applications and conduct loan interviews.
Assisted members with their financial transactions, involving paying and receiving cash and other negotiable instruments.
Maintained proper cash levels at the branch.
Responsible for cash shipments to and from main office to the branch.
Processed all commercial deposits, balanced vault daily.
Responsible for equipment maintenance; assisted staff with balancing problems.
Did random spot check with staff to ensure cash levels are within predetermined branch limits.
Education
Bachelor of Science Degree : Finance , May 2010
University of Maryland - State
Finance
Skills
Accounting, Accounting System, accounts payable, accruals, Articulate, ATM, banking, budget, Business Intelligence, calculator, cash flow,
cashier, closing, Credit, documentation, equipment maintenance, filing, Finance, Financial, financial reports, financial statements, preparation of
financial statements, fixed assets, funds, general ledger, general ledger accounts, ledger, mailing, Access, Excel, Microsoft Office, office,
PowerPoint, Microsoft Word, Works, networks, PeopleSoft, policies, processes, coding, receiving, reconciling, Maintains files, reporting,
research, sales, scanning, scheduling, phone, year-end"
