Category,Resume
AGRICULTURE,"GRADUATE RESEARCH ASSISTANT
Profile
Results-driven Animal Nutritionist with good research and teaching experience
Areas of Expertise
Dairy Nutrition
Food Safety
Feed supplementation strategies
Professional Experience
Graduate Research Assistant 07/2013 to Current Company Name City , State
Ongoing Researches
-Effect of prototype sequestering agents on performance and milk aflatoxin M1 concentrations of dairy cows fed aflatoxin B1-contaminated diets.
-The effect of selected lactic acid bacteria on the microbial composition and on the survival of pathogens in the rumen in context with their
probiotic effects on ruminants
-An in-vitro study on the use of tropical plants and essential oils in mitigating methanogenesis in ruminant.
Assistant Lecturer 08/2010 to 06/2013 Company Name City , State
-Instructed a class of 156 students in animal feed and feeding course
-Lectured and communicated effectively with students from diverse backgroups
-Inspired students to translate their academic interests into the real world by taking positive actions
Education
Ph.D. : Ruminant Nutrition 2017 University of Florida City , State , USA
Awards
-Grinter Fellowship for outstanding new PhD students
-Certificate of outstanding academic achievement, University of Florida International Center
Master of Science : Monogastric Nutrition 2011 University of Agriculture City , State , Nigeria
Awards
-University of Agriculture Graduate Fellowship
-Postgraduate Tuition Scholarship for First Class Students in the University
-Dufil Prima Schloarship for postgraduate students in Nutrition
Bachelor of Agriculture : Animal Nutrition 2009 University of Agriculture, Abeokuta City , State , Nigeria
Award
Academic achievement award for graduating with a First class...4.59 out of 5.00.
Affiliations
Nigerian Society of Animal Production
American Society of Animal Science
Publications
Peer-reviewed Publications
-C. M. Huisden, N. J. Szabo, I.M. Ogunade and A. T. Adesogan (2014). Mucuna pruriens detoxification: 1. Effects of ensiling duration and
particle size. Animal Feed Science and Technology. (IN PRESS).-Ogunade I.M., Eruvbetine., D., Oyekunle, A.O, Fafiolu, A.O, Olorunsola, R.A., Oso, A.O., Sobayo, R.A., Falola, A.C., Osho, S.O. and O.M
Sogunle (2012). Control of salmonella organisms in laying hens through the use of feed additives. Nigeria Poultry Science Journal 9: 166-171.
-Olorunsola R.A, Eruvbetine D, Oyekunle M.A, Jegede A.V and Ogunade I.M (2012); Salmonella organism transmission in hatching broiler eggs,
Journal of Biology, Agriculture and Healthcare, Vol 2, No 10.
-I.B Allison, D.A Ekunseitan, A.A Ayoola, S.O Iposu, O.M.O Idowu, I.M Ogunade and S.O Osho (2013). Effect of beak amputation and sex
on the pecking rate damage and performance parameters of turkey. Paskitan Journal of Biological Sciences 16(19): 1022-1027.
-R.A. Sobayo., A. O. Oso, O.A. Adeyemi., O.G. Sodipe, A.O. Fafiolu, Odetola, O.M and I.M. Ogunade. 2013. Growth response and nutrient
digestibility of broiler chicken fed graded levels of phytobiotics (Garcinia kola; Bitter kola). Journal of Applied Agricultural Research 5(1), 91-99.
Official Publication of Agricultural Research Institute, Nigeria.
-A. O. Oso, A. S. Haastrup, A. J. Ajibade, K.O. Olowonefa, A.O. Aluko, I.M. Ogunade, S.O. Osho, A.M. Bamgbose. (2013). Growth
performance, apparent nutrient digestibility, caecal fermentation, ileal morphology and caecal microflora of growing rabbits fed diet containing
probiotics and prebiotics. Livestock Science. 157: 184-190.
-Oso, A. O, G.A. Williams, A.V. Jegede, R.A. Sobayo, A.O. Fafiolu, O.M.O. Idowu, M. O. Sogunle, O.S. Akinola, O.O. Adeleye, l A.R.
Olorunsola, I.M. Ogunade, S.O. Osho, F.O. Obadire, A.M Bamgbose. 2014. Interactive effect of whole millet feeding and mannan
oligossaccharides supplementation on growth performance, serum biochemistry and organ weights of helmeted guinea fowl (Numidia meleagris).
Livestock Science 159: 46-52.
-Osho, S.O., Oso, A.O., Akpan, I.E., Ayanniyi, T.A., Ogunade, I.M., Durosaro, S.O. and Idowu, O.M.O. (2013). Health status and blood
parameters of weaner rabbits fed diets containing varying dietary fibre and digestible energy levels. Journal of Biology, Agriculture and Healthcare.
3(19): 79-86. Published by International Institute for Science, Technology and Education, UNITED STATES OF AMERICA.
-Durosaro, S.O., Ojo, A., Fadare, A.O., Olowofeso, O., Ilori, B.M., Osho, S.O., Ogunade, I.M. and Ozoje, M.O. (2013). Effect of Coat
Colour on Water Intake and Feed Utilization of Intensively Reared West African Dwarf Sheep in the Humid Tropics. Journal of Biology,
Agriculture and Healthcare. 3(19): 31-37. Published by International Institute for Science, Technology and Education, UNITED STATES OF
AMERICA.
-Ekunseitan, D.A., Balogun, O.O., Eruvbetine, Daisy, Abiola, S.S., Sogunle, O.M., Ogunade, I.M., Egbeyale, L.T., Ayoola, A.A., Akinola,
O.F., Allison, I.B. and Osho, S.O. (2012). Visual assessment, proximate composition and cost analysis of three differently processed discarded
vegetable-bovine blood-rumen content mixtures as substitutes for conventional feedstuffs. Short Communication Nigerian Journal of Animal
Production 39(2):211-217.
Conference Papers
-Ibukun M. Ogunade, Kathy G. Arriola, Rafael M. Martins, Bibiana Y. Coy, Chelsea L. Curry, Deborah K. Terkoski, Amber Rubright, Marcos
G. Zenobi, Zhengxin Ma, Charles R. Staples, Adegbola T. Adesogan (2014). Effect of prototype sequestering agents on performance and milk
aflatoxin M1 concentrations of dairy cows fed aflatoxin B1-contaminated diets. ADSA-ASAS-CSAS Joint Annual Meeting, Missouri, USA
07/2014
-O. Oso, O. Erinle, A.V. Jegede, A.O. Fafiolu, R.A. Sobayo, R. Olorunsola, A.M. Bamgbose, I.M. Ogunade, S.O. Osho, W.A. Olayemi, F.O.
Oke. (2013). Effect of whole millet feeding and mannan oligosaccharides supplementation on organ weights of Cockerel Chicks. WPSA (UK
Branch) Annual Meeting 16th-17th April 2013. The Jubilee Campus, Nottingham University. UNITED KINGDOM-Ogunade, I.M., Eruvbetine D, Fafiolu, A. O., Oyekunle, M.A, Oso, A.O, Sobayo, R.A, Osho S.O, Ekunseitan D.A. 2012. Effect of dietary
mannan oligosaccharides on the prevalence of Salmonella organisms in the dropping of sampled laying hens within South-Western Nigeria. World's
Poultry Science Association (UK Branch) Annual meeting 24-25th April, pg 35 Jubilee Campus, Nottingham University. British Poultry Abstracts
8 (1):44-45. UNITED KINGDOM
Skills
-Great Organizational skills
-Good Numerical and analytical skills"
AGRICULTURE,"ADMINISTRATION OFFICE ASSISTANT
Summary
Enthusiastic student-teacher with superb leadership and communication skills. Easily cultivates trusting and productive relationships with students,
parents, teachers administration, and others. Effective at providing quality instruction and fostering a positive working environment with excellent
interpersonal and organization skills.
Highlights
Communication: Speaks effectively, articulate, concise, listens attentively, can think on my feet,
feels confident talking to people, persuades others, provides feedbacks, openly expresses ideas
Interpersonal: Motivates others, understands others, works well with others, supportive,
cooperative, counsels, and accepts responsibility Calm under pressure
Management: Leads others, makes decisions, takes charge or initiative, can teach or mentor others Decisive
Organizational: Punctual, multi-task, meets deadlines, sets goals, manages projects Curriculum development
Computer: Mastery of Microsoft Office Programs (Excel, Word, PowerPoint, Outlook), Ability to Organizational development
work with several operating systems knowledge
Attention to Detail: Produces work that is neat and attractive, ensures that tasks are all done Member of Portland Helping
Flexible: Willing to try new things, able to work on schedule, interested in improving efficiency on Hands and Family Homeless
any task Shelter
Accomplishments
Rota High School, 2009-2013: Class Valedictorian, National Honor Society President, Youth Advisory President, Anti-Bullying Campaign
President, Take Action Youth Advocacy Member, Junior Achievement Program Public Relations Officer, Army JROTC Company
Commander, Won Most Outstanding Female Graduate, and Leadership Award
Founded and led a comprehensive after school enrichment program at Rota Elementary School: ""The Reading Bridge Project""
University of Portland Student, Class of 2017. Elementary Education Major. Army ROTC, and Kappa Delta Pi (Education) Honor Society
Officer.
Led 3 Summer Camp Programs, and student teach in 3 schools at the Portland District
Experience
Administration Office Assistant 06/2010 to 08/2010 Company Name City , State
(Summer Job) Worked with the Director of the Cultural Affairs department in filing papers, answering phone calls, assisting on historic
preservation projects, working with clients, and educating young students about the importance of preserving the island's culture and language. 2.
Department of Public Safety (Rota, M.P., 96951, Songsong Village, District 3, CNMI)
Administration Office Assistant and Public Safety Trainee 07/2011 to 08/2011 Company Name City , State
Assisted on paper works with public safety, arranged meetings, answered phone calls, filed paper works, assisted on traffic, worked with police
officers on radar speed detection on highways, patrolled around the island for any vehicles not conforming to the law, had CPR training, worked
with fire department on fire safety rules. 3. Northern Marianas College Internship Program (Rota, M.P., 96951, Highway, CNMI)
Nutrition and Agriculture Internship Trainee 07/2012 to 08/2012 Company Name City , State
(Internship Program) Trained under the nutritional program with food safety and healthy diet, assisted on presentations for children about nutrition,
made healthy ice cream and beef jerky to distribute to the community, taught the community about different types of healthy cooking methods,
went around the island to visit farmers who are having problems with crops, educating farmers as to how to maintain their soil, studying the
different diseases of plants and ways to identify symptoms, presented the importance of agriculture to the community. 4. Cooperative Education
Program Workforce (Rota High School, M.P., 96951, Songsong Village, CNMI) Teacher Aide for High School students
COOP Program Trainee 02/2013 to 09/2013 Company Name City , State
Assisted in tutoring students who are below average, worked with teachers on projects and plans to help improve both math and English
departments, made assignments to help students practice their skills, made educational games, worked with SPED students, assisted on
parent/teacher meetings, and joined hand in hand with teachers and staff to evaluate the progress of students throughout the school year.
Student Activities Office Assistant 08/2013 to 12/2014 Company Name City , State
Helped organized activities in the University's Campus. Worked with other Universities to create combined events. Assisted clubs and
organizations for sponsored activities volunteering opportunities
EducationHigh School Diploma : General 2013 Rota High School City , State
Bachelor of Arts : Elementary Education 2017 University of Portland City , State
University of Portland Student. Majoring in Elementary Education, Class of 2017. ARMY ROTC. Kappa Delta Pi Honor Society Officer.
Affiliations
Portland Helping Hands and Family Homeless Shelter
Skills
Public Speaking, Student Involvement, and Organizational"
AGRICULTURE,"SENIOR FIELD APPLICATION SPECIALIST
Summary
Senior Field Application Specialist with extensive customer training experience for a large, international, biotech company. An expert on multiple In
Vitro Diagnostic systems and microbial methodologies, all utilized by laboratories in the pursuit of, food science, environmental testing,
pharmaceutical development, pharmaceutical research, veterinary care, blood banking, clinical research and clinical diagnostics.
Education and Training
2007 Bachelor of Science : Metropolitan State University of Denver - Microbiology and Molecular Biology City , State , USA Microbiology and
Molecular Biology
Experience
Senior Field Application Specialist 06/2014 ï¼​ 06/2016 Company Name City , State
Responsible for first line of customer support and troubleshooting both onsite and remotely.
Provided proficient and timely instrument training, validation and implementation for bio health care customers on the use of all Biomerieux
platforms and assays; Immunoassay, microbial Identification, microbial resistance, mass spectrometry MALDI-TOF, sterility, microbial
enumeration, DNA/RNA extraction, DNA strain typing, media management, and blood banking.
Strictly adhered to government guidelines and regulations.
Aided the marketing, engineering and sales groups to increase offerings and solutions.
Remained the technical expert on all products.
Organized and managed a large territory through proper reporting and proof of accountability.
Field Application Specialist 01/2008 ï¼​ 06/2014 Company Name City , State
Responsible for first line of customer support and troubleshooting both onsite and remotely.
Provided proficient and timely instrument training, validation and implementation for industrial micro customers on the use of all Biomerieux
platforms and assays; Immunoassay, microbial Identification, microbial resistance, mass spectrometry MALDI-TOF, sterility, microbial
enumeration, DNA/RNA extraction, DNA strain typing, media management, and blood banking.
Strictly adhered to government guidelines and regulations.
Aided the marketing, engineering and sales groups to increase offerings and solutions.
Remained the technical expert on all products.
Organized and managed a large territory through proper reporting and proof of accountability.
2013 Field Application Specialist of the Year.
2008 Field Application Specialist of the Year.
National Trainer VITEK Mass Spectrometer MALDI-TOF.
Validated TEMPO for the USDA MDP program.
Developed and implemented new training materials and guidelines.
Lead trainer of the Diversilab DNA strain typing System, and lead molecular support.
Designed Biomerieux training and certification for the Food Emergency Response Network.
Lab Technician 01/2007 ï¼​ 12/2007 Company Name City , State
Hired to work on a Federal funded program testing produce for human pathogens.
Utilized several in vitro diagnostic systems, DNA Extraction and Amplification, and minimal Chemistry GC/MS.
Teaching Assistant/ Research Assistant 01/2005 ï¼​ 01/2007 Company Name City , State
Cell and Molecular Teaching and Research Assistant.
Responsible for materials used in lectures and practical work.
Led lectures, graded papers.
Assisted in Cell and Molecular Research.
Skills
banking, Chemistry, customer support, DNA, GC, government, marketing, materials, Network, reporting, Research, sales, Teaching, Trainer,
training materials, troubleshooting, typing, validation"
AGRICULTURE,"GRADUATE RESEARCH ASSISTANT
Professional Summary
Dedicated professional with excellent technical, analytical and communication skills demonstrated in ten years of experience in the agricultural
sector, specifically in the Research and Development division with an extensive knowledge of biological control in the field of Entomology
Core Qualifications
Background in biological control using member from the Coleopteran family of Area wide surveys and data collection for
insect research
Expert in data analysis Data presentation
Experimental design/implementation
Accomplishments
Successfully determine the biology, reproduction and the effect of chemicals on the Thalassa montezumae , a predatory beetle of the new
invasive scale insect Phalacrococcus howertoni in South Florida.
Integrated Pest Management Workshop Identification of Scales Mealybugs and Natural enemies.
Identification of Mites of economic importance to the Caribbean and their Natural enemies Training Seminar on Management of Protected
Cultivation Insect.
Identification of Nematodes for Professional Consultants Green house training course.
Experience
Company Name City , State GRADUATE RESEARCH ASSISTANT 01/2013 to 04/2016
Assist with various research project in the Center of Biological control lab.
Developing a potential biological control for Croton Scales ( Phalacrococcus howertoni ).
Maintain culture of Croton scales and Thalassa montezumae under green house and laboratory conditions,.
Company Name City PLANT PROTECTION OFFICER - Entomology 10/2011 to 12/2012
Rear Parasitoids wasp ( Anagyrus kamali ) and release in areas affected by the Pink Hibiscus Mealy bug ( Maconellicoccus hirsutus )
with 95% success rate and determined parasitism levels at each site.
Record data.
Maintain cultures of Pink Hibiscus Mealybug and Anagyrus kamali at rearing facility.
Develop solutions for pest problems in yam ( Dioscorea spp .) in Jamaica
Establish and conduct field evaluations with treatments against yam nematodes.
Develop Citrus Greening Management Programme in Jamaica in collaboration with Food and Agriculture Organization and Government of
Jamaica Components.
Assist in the Island wide survey for incidence of citrus greening and parasitism levels of Tamarixia radiate .
Assist the monitoring programme for the Area-wide Integrated Management Systems (AIMS) for Citrus greening in citrus orchards.
Develop management program for the Beet Army Worm( Spodoptera exigua ) and monitoring of farms in affected parishes.
Establish & maintain Beet Army Worm culture in the laboratory.
Conduct insecticide efficacy trial.
Implement Integrated Pest Management of major pests of crops under Protective Cultivation in Jamaica
Data generated on temperature, humidity and pest status in greenhouse crop.
Company Name City FIELD AND LAB RESEARCH ASSISTANT 12/2002 to 10/2011
Receive diagnostic samples from extension officers and farmers.
Prepare samples for diagnostics.
Rear and preserved specimens as necessary.
Establish experimental plots.
Visit field for prescribed observations and data collection as was set out in proposals.
Monitor on and off station experimental plots for infestations.
Maintain inventory list, materials and lab space.
Work on all research projects in the unit.
Assist in Crop and Plant Protection Unit Integrated Pest Management Systems developing on several crops threshold base pesticides.
Population dynamic study on Red Palm Mites and Broad Mites.
Education
Master of Science : Entomology - Qualifying 2016 Florida Agricultural & Mechanical University , City , State , United States
Bachelor of Science : Environmental Science 2011 Knox Community College , City , Jamaica
Associate of Science : General Agriculture 2006 College of Agriculture Science and Education , City , JamaicaProfessional Affiliations
Entomological Society of America (ESA)
Florida Entomological Society
Florida Agricultural & Mechanical University ESA debate team
Minorities in Agriculture, Natural Resources and Related Sciences (MANNRS)
Awards and Publications
Reuben Capelouto Foundation and William L.Peters Memorial scholarship awardee 2013-2014 Monsanto 1890 Student Leadership Event
participant, St.Louis Missouri, 2014
Mentoring at Purdue Summer Scholarship Program participant West Lafayette, Indiana, 2014.
ESA(Entomological Society of America). Annual Meeting. Portland, Oregon. Developing a Biological Control Measure for the Management of an
Invasive Scale Insect, Phalacrococcus howertoni (Hemiptera,Coccidae) in South Florida ""Published Abstract.
ESA (Entomological Society of America). Annual Meeting. Portland, Oregon. â€œWhat is the single best tool to reduce malaria cases throughout
the world? â€œPublished Article , 2014
Skills
Data collection, maintain inventory,statistical analysis, prepare sample and Microsoft office"
APPAREL,"KEY HOLDER
Summary
Highly organized efficient in multitasking environments; able to prioritize effectively to accomplish objectives with creativity, enthusiasm and humor.
Resourceful and flexible, able to adapt to changing priorities and maintain a positive attitude with strong work ethic.
Highlights
Microsoft Outlook, Word and Excel Skilled trainer MS Office expert Customer-focused Strong interpersonal skills Effective workflow
management Accomplished manager Goal-oriented Positive and upbeat
Experience
Key Holder 08/2012 to Current Company Name City , State
Trained all incoming sales team members.
Promptly resolved all customer requests, questions and complaints.
Maintained knowledge of current sales and promotions, policies regarding payment and exchanges and security practices.
Assumed ownership over team productivity and managed work flow to meet or exceed quality service goals.
Trained staff on operating procedures and company services.
Prepared for opening and closing of the store.
Collections Specialist 02/2010 to 04/2011 Company Name City , State
Effectively managed a high-volume of inbound and outbound customer calls.
Evaluated and initiated alternatives for resolving account balances.
Responded to customer inquires regarding account status.
Coordinated collection activities for delinquent accounts.
Resolved customer situations calmly and courteously.
Accurately documented, researched and resolved customer service issues.
Met or exceeded service and quality standards every review period.
Sales Associate 07/2008 to 04/2009 City , State
Greeted customers in a timely fashion while quickly determining their needs.
Maintained knowledge of current sales and promotions, policies regarding payment and exchanges and security practices.
Contributed to team success by exceeding team sales goals.
Operate cash register and receives payment from customer in cash or debit Participated in physical inventory counts.
Education
Certificate: Current Temple Real Estate school : Marketing 2008 Virginia Union University City , State Marketing
Skills
cash register, closing, Strong interpersonal skills, customer service, debit, fashion, inventory, Excel, MS Office, Microsoft Outlook, Word,
policies, quality, Real Estate, sales, trainer, workflow"
